{
  "schema_version": "1.0.0",
  "pack_id": "pack_in_uttar_pradesh",
  "pack_version": 1,
  "region": {
    "country_code": "IN",
    "subdivision_code": "IN-UP",
    "name": "Uttar Pradesh",
    "agro_climatic_zones": [
      "Upper Gangetic Plains Region (zone 5)",
      "Middle Gangetic Plains Region (zone 4)",
      "Central Plateau and Hills (Bundelkhand, zone 8)"
    ]
  },
  "license": "CC-BY-4.0",
  "review": {
    "status": "curated_pending_review",
    "reviewer": null,
    "reviewed_at": null,
    "note": "Sowing windows curated from UP Department of Agriculture and SAU packages of practices; awaiting state expert review."
  },
  "sources": [
    {
      "title": "Department of Agriculture, Uttar Pradesh - Kharif and Rabi packages of practices",
      "url": "https://upagriculture.com/"
    },
    {
      "title": "Chandra Shekhar Azad University of Agriculture and Technology, Kanpur",
      "url": "https://csauk.ac.in/"
    },
    {
      "title": "CGWB Dynamic Ground Water Resources of India",
      "url": "https://cgwb.gov.in/"
    }
  ],
  "seasons": [
    {
      "id": "kharif",
      "months": [
        6,
        7,
        8,
        9,
        10
      ]
    },
    {
      "id": "rabi",
      "months": [
        10,
        11,
        12,
        1,
        2,
        3
      ]
    },
    {
      "id": "zaid",
      "months": [
        3,
        4,
        5,
        6
      ]
    }
  ],
  "groundwater": {
    "category": "semi_critical",
    "scope": "state",
    "note": "State-average extraction is near the semi-critical threshold; many western UP blocks are over-exploited while eastern UP is largely safe.",
    "source": "CGWB Dynamic Ground Water Resources of India"
  },
  "crops": [
    {
      "crop_id": "rice",
      "scientific_name": "Oryza sativa",
      "sowing_windows": [
        {
          "season": "kharif",
          "start": "06-20",
          "end": "07-20",
          "irrigation_required": true,
          "label": "transplanting"
        }
      ]
    },
    {
      "crop_id": "wheat",
      "scientific_name": "Triticum aestivum",
      "sowing_windows": [
        {
          "season": "rabi",
          "start": "11-01",
          "end": "11-25",
          "irrigation_required": true,
          "label": "timely"
        },
        {
          "season": "rabi",
          "start": "12-01",
          "end": "12-25",
          "irrigation_required": true,
          "label": "late sown"
        }
      ]
    },
    {
      "crop_id": "mustard",
      "scientific_name": "Brassica juncea",
      "sowing_windows": [
        {
          "season": "rabi",
          "start": "10-01",
          "end": "10-25",
          "irrigation_required": false
        }
      ]
    },
    {
      "crop_id": "chickpea",
      "scientific_name": "Cicer arietinum",
      "sowing_windows": [
        {
          "season": "rabi",
          "start": "10-15",
          "end": "11-15",
          "irrigation_required": false
        }
      ]
    },
    {
      "crop_id": "lentil",
      "scientific_name": "Lens culinaris",
      "sowing_windows": [
        {
          "season": "rabi",
          "start": "10-15",
          "end": "11-15",
          "irrigation_required": false
        }
      ]
    },
    {
      "crop_id": "field_pea",
      "scientific_name": "Pisum sativum",
      "sowing_windows": [
        {
          "season": "rabi",
          "start": "10-15",
          "end": "11-15",
          "irrigation_required": false
        }
      ]
    },
    {
      "crop_id": "barley",
      "scientific_name": "Hordeum vulgare",
      "sowing_windows": [
        {
          "season": "rabi",
          "start": "11-01",
          "end": "11-25",
          "irrigation_required": false
        }
      ]
    },
    {
      "crop_id": "pigeon_pea",
      "scientific_name": "Cajanus cajan",
      "sowing_windows": [
        {
          "season": "kharif",
          "start": "06-15",
          "end": "07-15",
          "irrigation_required": false
        }
      ]
    },
    {
      "crop_id": "maize",
      "scientific_name": "Zea mays",
      "sowing_windows": [
        {
          "season": "kharif",
          "start": "06-15",
          "end": "07-15",
          "irrigation_required": false
        }
      ]
    },
    {
      "crop_id": "pearl_millet",
      "scientific_name": "Pennisetum glaucum",
      "sowing_windows": [
        {
          "season": "kharif",
          "start": "07-01",
          "end": "07-25",
          "irrigation_required": false
        }
      ]
    },
    {
      "crop_id": "sorghum",
      "scientific_name": "Sorghum bicolor",
      "sowing_windows": [
        {
          "season": "kharif",
          "start": "06-25",
          "end": "07-15",
          "irrigation_required": false
        }
      ]
    },
    {
      "crop_id": "green_gram",
      "scientific_name": "Vigna radiata",
      "sowing_windows": [
        {
          "season": "zaid",
          "start": "03-10",
          "end": "04-10",
          "irrigation_required": true,
          "label": "zaid"
        },
        {
          "season": "kharif",
          "start": "07-01",
          "end": "07-20",
          "irrigation_required": false
        }
      ]
    },
    {
      "crop_id": "black_gram",
      "scientific_name": "Vigna mungo",
      "sowing_windows": [
        {
          "season": "zaid",
          "start": "03-10",
          "end": "04-10",
          "irrigation_required": true,
          "label": "zaid"
        },
        {
          "season": "kharif",
          "start": "07-01",
          "end": "07-20",
          "irrigation_required": false
        }
      ]
    },
    {
      "crop_id": "groundnut",
      "scientific_name": "Arachis hypogaea",
      "sowing_windows": [
        {
          "season": "kharif",
          "start": "06-15",
          "end": "07-15",
          "irrigation_required": false
        }
      ],
      "note": "Mainly Bundelkhand and western UP light soils."
    },
    {
      "crop_id": "sesame",
      "scientific_name": "Sesamum indicum",
      "sowing_windows": [
        {
          "season": "kharif",
          "start": "07-01",
          "end": "07-20",
          "irrigation_required": false
        }
      ]
    },
    {
      "crop_id": "sugarcane",
      "scientific_name": "Saccharum officinarum",
      "sowing_windows": [
        {
          "season": "zaid",
          "start": "02-15",
          "end": "03-31",
          "irrigation_required": true,
          "label": "spring"
        },
        {
          "season": "rabi",
          "start": "10-01",
          "end": "10-31",
          "irrigation_required": true,
          "label": "autumn"
        }
      ]
    },
    {
      "crop_id": "potato",
      "scientific_name": "Solanum tuberosum",
      "sowing_windows": [
        {
          "season": "rabi",
          "start": "10-01",
          "end": "10-31",
          "irrigation_required": true
        }
      ]
    },
    {
      "crop_id": "berseem",
      "scientific_name": "Trifolium alexandrinum",
      "sowing_windows": [
        {
          "season": "rabi",
          "start": "10-01",
          "end": "10-31",
          "irrigation_required": true
        }
      ]
    },
    {
      "crop_id": "dhaincha",
      "scientific_name": "Sesbania bispinosa",
      "sowing_windows": [
        {
          "season": "zaid",
          "start": "04-15",
          "end": "05-31",
          "irrigation_required": true,
          "label": "green manure before paddy"
        }
      ]
    }
  ],
  "districts": [],
  "priority_practices": [
    "reduced-disturbance",
    "green-manure",
    "legume-rotation",
    "residue-retention",
    "intercropping-pulses"
  ],
  "regulations": []
}
